"Status","Start Time","Stop Time","Duration in ms","Parent Suite","Suite","Sub Suite","Test Class","Test Method","Name","Description"
"broken","Sat Jul 16 16:18:12 UTC 2022","Sat Jul 16 16:18:12 UTC 2022","1","","Login Functionality","","","","login with invalid password credentials read data from fixture",""
"broken","Sat Jul 16 16:18:10 UTC 2022","Sat Jul 16 16:18:12 UTC 2022","1219","","Login Functionality","","","","login with valid credentials",""
"broken","Sat Jul 16 16:18:12 UTC 2022","Sat Jul 16 16:18:12 UTC 2022","0","","Login Functionality","","","","login with valid credentials read data from fixture",""
"broken","Sat Jul 16 16:18:50 UTC 2022","Sat Jul 16 16:18:51 UTC 2022","955","","My Account Functionality","","","","Sample Test",""
"broken","Sat Jul 16 16:18:12 UTC 2022","Sat Jul 16 16:18:12 UTC 2022","0","","Login Functionality","","","","login with wrong email format credentials read data from fixture",""
"broken","Sat Jul 16 16:18:12 UTC 2022","Sat Jul 16 16:18:12 UTC 2022","0","","Login Functionality","","","","login with invalid email credentials read data from fixture",""
